Codec: IDT 92HD73C1X5
Address: 0
Vendor Id: 0x111d7675
Subsystem Id: 0x10280254
Revision Id: 0x100202
No Modem Function Group found
Default PCM:
   rates [0x5e0]: 44100 48000 88200 96000 192000
   bits [0xe]: 16 20 24
   formats [0x1]: PCM
Default Amp-In caps: ofs=0x00, nsteps=0x03, stepsize=0x27, mute=0
Default Amp-Out caps: ofs=0x7f, nsteps=0x7f, stepsize=0x02, mute=1
GPIO: io=8, o=0, i=0, unsolicited=1, wake=1
 IO[0]: enable=1, dir=1, wake=0, sticky=0, data=1
 IO[1]: enable=0, dir=0, wake=0, sticky=0, data=0
 IO[2]: enable=0, dir=0, wake=0, sticky=0, data=0
 IO[3]: enable=0, dir=0, wake=0, sticky=0, data=0
 IO[4]: enable=0, dir=0, wake=0, sticky=0, data=0
 IO[5]: enable=0, dir=0, wake=0, sticky=0, data=0
 IO[6]: enable=0, dir=0, wake=0, sticky=0, data=0
 IO[7]: enable=0, dir=0, wake=0, sticky=0, data=0
Node 0x0a [Pin Complex] wcaps 0x400183: Stereo Amp-In
 Amp-In caps: N/A
 Amp-In vals:  [0x00 0x00]
 Pincap 0x08173f: IN OUT HP Detect Trigger ImpSense
   Vref caps: HIZ 50 GRD 80
 Pin Default 0x0321101f: [Jack] HP Out at Ext Left
   Conn = 1/8, Color = Black
   DefAssociation = 0x1, Sequence = 0xf
 Pin-ctls: 0xc0: OUT HP VREF_HIZ
 Unsolicited: tag=30, enabled=1
 Connection: 4
    0x15 0x16* 0x17 0x1e
Node 0x0b [Pin Complex] wcaps 0x400183: Stereo Amp-In
 Amp-In caps: N/A
 Amp-In vals:  [0x00 0x00]
 Pincap 0x08173f: IN OUT HP Detect Trigger ImpSense
   Vref caps: HIZ 50 GRD 80
 Pin Default 0x4f00000f: [N/A] Line Out at Ext UNKNOWN
   Conn = Unknown, Color = Unknown
   DefAssociation = 0x0, Sequence = 0xf
 Pin-ctls: 0x00: VREF_HIZ
 Unsolicited: tag=00, enabled=0
 Connection: 4
    0x15* 0x16 0x17 0x1e
Node 0x0c [Pin Complex] wcaps 0x400183: Stereo Amp-In
 Amp-In caps: N/A
 Amp-In vals:  [0x00 0x00]
 Pincap 0x081737: IN OUT Detect Trigger ImpSense
   Vref caps: HIZ 50 GRD 80
 Pin Default 0x4f0000f0: [N/A] Line Out at Ext UNKNOWN
   Conn = Unknown, Color = Unknown
   DefAssociation = 0xf, Sequence = 0x0
 Pin-ctls: 0x00: VREF_HIZ
 Unsolicited: tag=00, enabled=0
 Connection: 4
    0x15* 0x16 0x17 0x1e
Node 0x0d [Pin Complex] wcaps 0x400183: Stereo Amp-In
 Amp-In caps: N/A
 Amp-In vals:  [0x00 0x00]
 Pincap 0x083f: IN OUT HP Detect Trigger ImpSense
 Pin Default 0x90170110: [Fixed] Speaker at Int N/A
   Conn = Analog, Color = Unknown
   DefAssociation = 0x1, Sequence = 0x0
   Misc = NO_PRESENCE
 Pin-ctls: 0x40: OUT
 Unsolicited: tag=00, enabled=0
 Connection: 4
    0x15* 0x16 0x17 0x1e
Node 0x0e [Pin Complex] wcaps 0x400183: Stereo Amp-In
 Amp-In caps: N/A
 Amp-In vals:  [0x00 0x00]
 Pincap 0x081737: IN OUT Detect Trigger ImpSense
   Vref caps: HIZ 50 GRD 80
 Pin Default 0x03a11020: [Jack] Mic at Ext Left
   Conn = 1/8, Color = Black
   DefAssociation = 0x2, Sequence = 0x0
 Pin-ctls: 0x24: IN VREF_80
 Unsolicited: tag=00, enabled=0
 Connection: 4
    0x15* 0x16 0x17 0x1e
Node 0x0f [Pin Complex] wcaps 0x400183: Stereo Amp-In
 Amp-In caps: N/A
 Amp-In vals:  [0x00 0x00]
 Pincap 0x0837: IN OUT Detect Trigger ImpSense
 Pin Default 0x0321101f: [Jack] HP Out at Ext Left
   Conn = 1/8, Color = Black
   DefAssociation = 0x1, Sequence = 0xf
 Pin-ctls: 0x40: OUT
 Unsolicited: tag=35, enabled=1
 Connection: 4
    0x15 0x16 0x17* 0x1e
Node 0x10 [Pin Complex] wcaps 0x400183: Stereo Amp-In
 Amp-In caps: N/A
 Amp-In vals:  [0x00 0x00]
 Pincap 0x0837: IN OUT Detect Trigger ImpSense
 Pin Default 0x4f0000f0: [N/A] Line Out at Ext UNKNOWN
   Conn = Unknown, Color = Unknown
   DefAssociation = 0xf, Sequence = 0x0
 Pin-ctls: 0x00:
 Unsolicited: tag=00, enabled=0
 Connection: 4
    0x15* 0x16 0x17 0x1e
Node 0x11 [Pin Complex] wcaps 0x400183: Stereo Amp-In
 Amp-In caps: N/A
 Amp-In vals:  [0x00 0x00]
 Pincap 0x0837: IN OUT Detect Trigger ImpSense
 Pin Default 0x4f0000f0: [N/A] Line Out at Ext UNKNOWN
   Conn = Unknown, Color = Unknown
   DefAssociation = 0xf, Sequence = 0x0
 Pin-ctls: 0x00:
 Unsolicited: tag=00, enabled=0
 Connection: 4
    0x15* 0x16 0x17 0x1e
Node 0x12 [Pin Complex] wcaps 0x400081: Stereo
 Pincap 0x0824: IN Detect
 Pin Default 0x4f0000f0: [N/A] Line Out at Ext UNKNOWN
   Conn = Unknown, Color = Unknown
   DefAssociation = 0xf, Sequence = 0x0
 Pin-ctls: 0x00:
 Unsolicited: tag=00, enabled=0
Node 0x13 [Pin Complex] wcaps 0x400003: Stereo Amp-In
 Amp-In caps: N/A
 Amp-In vals:  [0x00 0x00]
 Pincap 0x0820: IN
 Pin Default 0x90a60160: [Fixed] Mic at Int N/A
   Conn = Digital, Color = Unknown
   DefAssociation = 0x6, Sequence = 0x0
   Misc = NO_PRESENCE
 Pin-ctls: 0x20: IN
Node 0x14 [Pin Complex] wcaps 0x400003: Stereo Amp-In
 Amp-In caps: N/A
 Amp-In vals:  [0x00 0x00]
 Pincap 0x0820: IN
 Pin Default 0x4f0000f0: [N/A] Line Out at Ext UNKNOWN
   Conn = Unknown, Color = Unknown
   DefAssociation = 0xf, Sequence = 0x0
 Pin-ctls: 0x00:
Node 0x15 [Audio Output] wcaps 0xd0c05: Stereo Amp-Out R/L
 Amp-Out caps: N/A
 Amp-Out vals:  [0x41 0x41]
 Converter: stream=5, channel=0
 Power: setting=D0, actual=D0
 Delay: 13 samples
Node 0x16 [Audio Output] wcaps 0xd0c05: Stereo Amp-Out R/L
 Amp-Out caps: N/A
 Amp-Out vals:  [0x5a 0x5a]
 Converter: stream=5, channel=0
 Power: setting=D0, actual=D0
 Delay: 13 samples
Node 0x17 [Audio Output] wcaps 0xd0c05: Stereo Amp-Out R/L
 Amp-Out caps: N/A
 Amp-Out vals:  [0x0f 0x0f]
 Converter: stream=5, channel=0
 Power: setting=D0, actual=D0
 Delay: 13 samples
Node 0x18 [Vendor Defined Widget] wcaps 0xfd0c05: Stereo Amp-Out R/L
 Amp-Out caps: N/A
 Amp-Out vals:  [0xff 0xff]
 Power: setting=D0, actual=D3
 Delay: 13 samples
Node 0x19 [Vendor Defined Widget] wcaps 0xfd0c05: Stereo Amp-Out R/L
 Amp-Out caps: N/A
 Amp-Out vals:  [0xff 0xff]
 Power: setting=D0, actual=D3
 Delay: 13 samples
Node 0x1a [Audio Input] wcaps 0x1d0541: Stereo
 Converter: stream=0, channel=0
 SDI-Select: 0
 Power: setting=D0, actual=D0
 Delay: 13 samples
 Connection: 1
    0x20
 Processing caps: benign=0, ncoeff=0
Node 0x1b [Audio Input] wcaps 0x1d0541: Stereo
 Converter: stream=0, channel=0
 SDI-Select: 0
 Power: setting=D0, actual=D0
 Delay: 13 samples
 Connection: 1
    0x21
 Processing caps: benign=0, ncoeff=0
Node 0x1c [Beep Generator Widget] wcaps 0x70000c: Mono Amp-Out
 Amp-Out caps: ofs=0x03, nsteps=0x03, stepsize=0x17, mute=1
 Amp-Out vals:  [0x00]
Node 0x1d [Audio Mixer] wcaps 0x20010b: Stereo Amp-In
 Amp-In caps: ofs=0x17, nsteps=0x1f, stepsize=0x05, mute=1
 Amp-In vals:  [0x97 0x97] [0x97 0x97] [0x97 0x97] [0x97 0x97] [0x97 0x97]
 Connection: 5
    0x28 0x29 0x2a 0x2b 0x12
Node 0x1e [Audio Selector] wcaps 0x30010d: Stereo Amp-Out
 Amp-Out caps: ofs=0x1f, nsteps=0x1f, stepsize=0x05, mute=1
 Amp-Out vals:  [0x9f 0x9f]
 Connection: 1
    0x1d
Node 0x1f [Volume Knob Widget] wcaps 0x600000: Mono
 Volume-Knob: delta=1, steps=127, direct=1, val=108
 Connection: 3
    0x15* 0x16 0x17
Node 0x20 [Audio Selector] wcaps 0x30090d: Stereo Amp-Out R/L
 Amp-Out caps: ofs=0x00, nsteps=0x0f, stepsize=0x05, mute=1
 Amp-Out vals:  [0x80 0x80]
 Connection: 12
    0x0a 0x0b 0x0c 0x0d 0x0e 0x0f 0x10 0x11 0x12 0x13 0x14 0x1d*
Node 0x21 [Audio Selector] wcaps 0x30090d: Stereo Amp-Out R/L
 Amp-Out caps: ofs=0x00, nsteps=0x0f, stepsize=0x05, mute=1
 Amp-Out vals:  [0x80 0x80]
 Connection: 12
    0x0a 0x0b 0x0c 0x0d 0x0e 0x0f 0x10 0x11 0x12 0x13 0x14 0x1d*
Node 0x22 [Pin Complex] wcaps 0x400301: Stereo Digital
 Pincap 0x0810: OUT
 Pin Default 0x4f0000f0: [N/A] Line Out at Ext UNKNOWN
   Conn = Unknown, Color = Unknown
   DefAssociation = 0xf, Sequence = 0x0
 Pin-ctls: 0x00:
 Connection: 3
    0x25* 0x20 0x21
Node 0x23 [Pin Complex] wcaps 0x400301: Stereo Digital
 Pincap 0x0810: OUT
 Pin Default 0x4f00000f: [N/A] Line Out at Ext UNKNOWN
   Conn = Unknown, Color = Unknown
   DefAssociation = 0x0, Sequence = 0xf
 Pin-ctls: 0x00:
 Connection: 3
    0x26* 0x20 0x21
Node 0x24 [Pin Complex] wcaps 0x400681: Stereo Digital
 Pincap 0x0810024: IN EAPD Detect
 EAPD 0x0:
 Pin Default 0x4f00000f: [N/A] Line Out at Ext UNKNOWN
   Conn = Unknown, Color = Unknown
   DefAssociation = 0x0, Sequence = 0xf
 Pin-ctls: 0x00:
 Unsolicited: tag=00, enabled=0
 Power: setting=D0, actual=D0
Node 0x25 [Audio Output] wcaps 0x4021d: Stereo Digital Amp-Out
 Amp-Out caps: ofs=0x00, nsteps=0x00, stepsize=0x00, mute=1
 Amp-Out vals:  [0x00 0x00]
 Converter: stream=0, channel=0
 Digital:
 Digital category: 0x0
 PCM:
   rates [0x5e0]: 44100 48000 88200 96000 192000
   bits [0xe]: 16 20 24
   formats [0x5]: PCM AC3
 Delay: 4 samples
Node 0x26 [Audio Output] wcaps 0x4021d: Stereo Digital Amp-Out
 Amp-Out caps: ofs=0x00, nsteps=0x00, stepsize=0x00, mute=1
 Amp-Out vals:  [0x00 0x00]
 Converter: stream=0, channel=0
 Digital:
 Digital category: 0x0
 PCM:
   rates [0x5e0]: 44100 48000 88200 96000 192000
   bits [0xe]: 16 20 24
   formats [0x5]: PCM AC3
 Delay: 4 samples
Node 0x27 [Audio Input] wcaps 0x14031b: Stereo Digital Amp-In
 Amp-In caps: ofs=0x00, nsteps=0x00, stepsize=0x00, mute=1
 Amp-In vals:  [0x00 0x00]
 Converter: stream=0, channel=0
 SDI-Select: 0
 Digital:
 Digital category: 0x0
 PCM:
   rates [0x160]: 44100 48000 96000
   bits [0xe]: 16 20 24
   formats [0x5]: PCM AC3
 Delay: 4 samples
 Connection: 1
    0x24
Node 0x28 [Audio Selector] wcaps 0x300101: Stereo
 Connection: 4
    0x0a 0x0b* 0x0d 0x0f
Node 0x29 [Audio Selector] wcaps 0x300101: Stereo
 Connection: 4
    0x0a 0x0e* 0x10 0x11
Node 0x2a [Audio Selector] wcaps 0x300101: Stereo
 Connection: 4
    0x0b 0x0c* 0x10 0x11
Node 0x2b [Audio Selector] wcaps 0x300101: Stereo
 Connection: 3
    0x15* 0x16 0x17
