Codec: SigmaTel STAC9200
Address: 0
Vendor Id: 0x83847690
Subsystem Id: 0x102801c1
Revision Id: 0x102201
Default PCM:
    rates [0x7e0]: 44100 48000 88200 96000 176400 192000
    bits [0xe]: 16 20 24
    formats [0x1]: PCM
Default Amp-In caps: N/A
Default Amp-Out caps: ofs=0x1f, nsteps=0x1f, stepsize=0x05, mute=1
Node 0x02 [Audio Output] wcaps 0xd0401: Stereo
  Power: 0x0
Node 0x03 [Audio Input] wcaps 0x1d0541: Stereo
  Power: 0x0
  Connection: 1
     0x0a
Node 0x04 [Audio Input] wcaps 0x140311: Stereo Digital
  PCM:
    rates [0x160]: 44100 48000 96000
    bits [0xe]: 16 20 24
    formats [0x5]: PCM AC3
  Connection: 1
     0x08
Node 0x05 [Audio Output] wcaps 0x40211: Stereo Digital
  PCM:
    rates [0x1e0]: 44100 48000 88200 96000
    bits [0xe]: 16 20 24
    formats [0x5]: PCM AC3
Node 0x06 [Vendor Defined Widget] wcaps 0xf30201: Stereo Digital
Node 0x07 [Audio Selector] wcaps 0x300901: Stereo
  Connection: 3
     0x02* 0x08 0x0a
Node 0x08 [Pin Complex] wcaps 0x430681: Stereo Digital
  Pincap 0x0810024: IN EAPD Detect
  Pin Default 0x40f000f0: [N/A] Other at Ext N/A
    Conn = Unknown, Color = Unknown
  Pin-ctls: 0x00:
  Power: 0x0
Node 0x09 [Pin Complex] wcaps 0x400301: Stereo Digital
  Pincap 0x0810: OUT
  Pin Default 0x40f000f1: [N/A] Other at Ext N/A
    Conn = Unknown, Color = Unknown
  Pin-ctls: 0x00:
  Connection: 2
     0x05* 0x0a
Node 0x0a [Audio Selector] wcaps 0x30090d: Stereo Amp-Out
  Amp-Out caps: ofs=0x00, nsteps=0x0f, stepsize=0x05, mute=1
  Amp-Out vals:  [0x08 0x08]
  Connection: 1
     0x0c
Node 0x0b [Audio Selector] wcaps 0x300105: Stereo Amp-Out
  Amp-Out caps: N/A
  Amp-Out vals:  [0x17 0x17]
  Connection: 1
     0x07
Node 0x0c [Audio Selector] wcaps 0x30010d: Stereo Amp-Out
  Amp-Out caps: ofs=0x00, nsteps=0x04, stepsize=0x27, mute=0
  Amp-Out vals:  [0x00 0x00]
  Connection: 5
     0x10* 0x0f 0x0e 0x0d 0x12
Node 0x0d [Pin Complex] wcaps 0x400181: Stereo
  Pincap 0x083f: IN OUT HP Detect
  Pin Default 0x0221101f: [Jack] HP Out at Ext Front
    Conn = 1/8, Color = Black
  Pin-ctls: 0xc0: OUT HP
  Connection: 1
     0x0b
Node 0x0e [Pin Complex] wcaps 0x400181: Stereo
  Pincap 0x083f: IN OUT HP Detect
  Pin Default 0x01014010: [Jack] Line Out at Ext Rear
    Conn = 1/8, Color = Green
  Pin-ctls: 0x40: OUT
  Connection: 1
     0x0b
Node 0x0f [Pin Complex] wcaps 0x400181: Stereo
  Pincap 0x0837: IN OUT Detect
  Pin Default 0x0181302e: [Jack] Line In at Ext Rear
    Conn = 1/8, Color = Blue
  Pin-ctls: 0x20: IN
  Connection: 1
     0x0b
Node 0x10 [Pin Complex] wcaps 0x400181: Stereo
  Pincap 0x081737: IN OUT Detect
  Pin Default 0x02a11020: [Jack] Mic at Ext Front
    Conn = 1/8, Color = Black
  Pin-ctls: 0x24: IN
  Connection: 1
     0x0b
Node 0x11 [Pin Complex] wcaps 0x400104: Mono Amp-Out
  Amp-Out caps: N/A
  Amp-Out vals:  [0x00]
  Pincap 0x0810: OUT
  Pin Default 0x40f000f2: [N/A] Other at Ext N/A
    Conn = Unknown, Color = Unknown
  Pin-ctls: 0x00:
  Connection: 1
     0x13
Node 0x12 [Pin Complex] wcaps 0x400001: Stereo
  Pincap 0x0820: IN
  Pin Default 0x40f000f3: [N/A] Other at Ext N/A
    Conn = Unknown, Color = Unknown
  Pin-ctls: 0x20: IN
Node 0x13 [Audio Mixer] wcaps 0x200100: Mono
  Connection: 1
     0x07
Node 0x14 [Beep Generator Widget] wcaps 0x70000c: Mono Amp-Out
  Amp-Out caps: ofs=0x03, nsteps=0x03, stepsize=0x17, mute=1
  Amp-Out vals:  [0x00]
