Codec: C-Media CMI9880
Address: 0
Vendor Id: 0x13f69880
Subsystem Id: 0xe1854
Revision Id: 0x100400
Default PCM:
    rates [0x540]: 48000 96000 192000
    bits [0xe]: 16 20 24
    formats [0x1]: PCM
Default Amp-In caps: N/A
Default Amp-Out caps: ofs=0x00, nsteps=0x00, stepsize=0x00, mute=1
Node 0x03 [Audio Output] wcaps 0x405: Stereo Amp-Out
  Amp-Out caps: N/A
  Amp-Out vals:  [0x00 0x00]
  Power: 0x0
Node 0x04 [Audio Output] wcaps 0x405: Stereo Amp-Out
  Amp-Out caps: N/A
  Amp-Out vals:  [0x00 0x00]
  Power: 0x0
Node 0x05 [Audio Output] wcaps 0x405: Stereo Amp-Out
  Amp-Out caps: N/A
  Amp-Out vals:  [0x00 0x00]
  Power: 0x0
Node 0x06 [Audio Output] wcaps 0x405: Stereo Amp-Out
  Amp-Out caps: N/A
  Amp-Out vals:  [0x00 0x00]
  Power: 0x0
Node 0x07 [Audio Output] wcaps 0x615: Stereo Digital Amp-Out
  Amp-Out caps: N/A
  Amp-Out vals:  [0x00 0x00]
  PCM:
    rates [0x0]:
    bits [0x0]:
    formats [0x5]: PCM AC3
  Power: 0x0
Node 0x08 [Audio Input] wcaps 0x10051b: Stereo Amp-In
  Amp-In caps: ofs=0x00, nsteps=0x1e, stepsize=0x05, mute=1
  Amp-In vals:  [0x80 0x80] [0x80 0x80] [0x80 0x80] [0x80 0x80] [0x80 0x80] [0x80 0x80] [0x80 0x80] [0x80 0x80] [0x80 0x80]
  PCM:
    rates [0x160]: 44100 48000 96000
    bits [0x2]: 16
    formats [0x0]:
  Power: 0x0
  Connection: 9
     0x0b 0x0c 0x0d 0x0e 0x0f 0x10* 0x11 0x1f 0x20
Node 0x09 [Audio Input] wcaps 0x10051b: Stereo Amp-In
  Amp-In caps: ofs=0x00, nsteps=0x1e, stepsize=0x05, mute=1
  Amp-In vals:  [0x12 0x12] [0x12 0x12] [0x12 0x12] [0x12 0x12] [0x12 0x12] [0x12 0x12] [0x12 0x12] [0x12 0x12] [0x12 0x12]
  PCM:
    rates [0x160]: 44100 48000 96000
    bits [0x2]: 16
    formats [0x0]:
  Power: 0x0
  Connection: 9
     0x0b 0x0c 0x0d 0x0e 0x0f 0x10* 0x11 0x1f 0x20
Node 0x0a [Audio Input] wcaps 0x100791: Stereo Digital
  PCM:
    rates [0x160]: 44100 48000 96000
    bits [0xe]: 16 20 24
    formats [0x0]:
  Power: 0x0
  Connection: 1
     0x13
Node 0x0b [Pin Complex] wcaps 0x400581: Stereo
  Pincap 0x0833f: IN OUT HP Detect
  Pin Default 0x01014010: [Jack] Line Out at Ext Rear
    Conn = 1/8, Color = Green
  Pin-ctls: 0xc0: OUT HP
  Power: 0x0
  Connection: 1
     0x03
Node 0x0c [Pin Complex] wcaps 0x400581: Stereo
  Pincap 0x0833f: IN OUT HP Detect
  Pin Default 0x01813000: [Jack] Line In at Ext Rear
    Conn = 1/8, Color = Blue
  Pin-ctls: 0x20: IN
  Power: 0x0
  Connection: 1
     0x04
Node 0x0d [Pin Complex] wcaps 0x400581: Stereo
  Pincap 0x0833f: IN OUT HP Detect
  Pin Default 0x01a15000: [Jack] Mic at Ext Rear
    Conn = 1/8, Color = Red
  Pin-ctls: 0x24: IN
  Power: 0x0
  Connection: 1
     0x05
Node 0x0e [Pin Complex] wcaps 0x400581: Stereo
  Pincap 0x081033f: IN OUT HP EAPD Detect
  Pin Default 0x90a11100: [Fixed] Mic at Int N/A
    Conn = 1/8, Color = Black
  Pin-ctls: 0xc0: OUT HP
  Power: 0x0
  Connection: 1
     0x06
Node 0x0f [Pin Complex] wcaps 0x400581: Stereo
  Pincap 0x0833f: IN OUT HP Detect
  Pin Default 0x02214000: [Jack] HP Out at Ext Front
    Conn = 1/8, Color = Green
  Pin-ctls: 0xc0: OUT HP
  Power: 0x0
  Connection: 4
     0x03* 0x04 0x05 0x06
Node 0x10 [Pin Complex] wcaps 0x400581: Stereo
  Pincap 0x0833f: IN OUT HP Detect
  Pin Default 0x02a15000: [Jack] Mic at Ext Front
    Conn = 1/8, Color = Red
  Pin-ctls: 0x24: IN
  Power: 0x0
  Connection: 4
     0x03* 0x04 0x05 0x06
Node 0x11 [Pin Complex] wcaps 0x400001: Stereo
  Pincap 0x0863: IN
  Pin Default 0x19330000: [Jack] CD at Int ATAPI
    Conn = ATAPI, Color = Unknown
  Pin-ctls: 0x00:
Node 0x12 [Pin Complex] wcaps 0x400301: Stereo Digital
  Pincap 0x0810: OUT
  Pin Default 0x01450000: [Jack] SPDIF Out at Ext Rear
    Conn = Optical, Color = Unknown
  Pin-ctls: 0x40: OUT
  Connection: 1
     0x07
Node 0x13 [Pin Complex] wcaps 0x400281: Stereo Digital
  Pincap 0x0830: IN OUT
  Pin Default 0x41150000: [N/A] Speaker at Ext Rear
    Conn = Optical, Color = Unknown
  Pin-ctls: 0x00:
Node 0x14 [Vendor Defined Widget] wcaps 0xf00000: Mono
Node 0x15 [Vendor Defined Widget] wcaps 0xf00000: Mono
Node 0x16 [Vendor Defined Widget] wcaps 0xf00000: Mono
Node 0x17 [Vendor Defined Widget] wcaps 0xf00000: Mono
Node 0x18 [Vendor Defined Widget] wcaps 0xf00000: Mono
Node 0x19 [Vendor Defined Widget] wcaps 0xf00000: Mono
Node 0x1a [Vendor Defined Widget] wcaps 0xf00000: Mono
Node 0x1b [Vendor Defined Widget] wcaps 0xf00000: Mono
Node 0x1c [Vendor Defined Widget] wcaps 0xf00000: Mono
Node 0x1d [Vendor Defined Widget] wcaps 0xf00000: Mono
Node 0x1e [Vendor Defined Widget] wcaps 0xf00000: Mono
Node 0x1f [Pin Complex] wcaps 0x400181: Stereo
  Pincap 0x0833f: IN OUT HP Detect
  Pin Default 0x90111100: [Fixed] Speaker at Int N/A
    Conn = 1/8, Color = Black
  Pin-ctls: 0xc0: OUT HP
  Connection: 4
     0x03 0x04 0x05* 0x06
Node 0x20 [Pin Complex] wcaps 0x400181: Stereo
  Pincap 0x0833f: IN OUT HP Detect
  Pin Default 0x01813000: [Jack] Line In at Ext Rear
    Conn = 1/8, Color = Blue
  Pin-ctls: 0xc0: OUT HP
  Connection: 4
     0x03 0x04* 0x05 0x06
Node 0x21 [Vendor Defined Widget] wcaps 0xf00000: Mono
Node 0x22 [Vendor Defined Widget] wcaps 0xf00000: Mono
Node 0x23 [Beep Generator Widget] wcaps 0x70000c: Mono Amp-Out
  Amp-Out caps: ofs=0x0f, nsteps=0x0f, stepsize=0x0b, mute=1
  Amp-Out vals:  [0x0f]
Codec: Generic 11c1 Si3054
Address: 1
Vendor Id: 0x11c13026
Subsystem Id: 0x11c13026
Revision Id: 0x100600
