Codec: SigmaTel CXD9872RD/K
Address: 0
Vendor Id: 0x83847661
Subsystem Id: 0x104d0800
Revision Id: 0x104201
Default PCM:
    rates [0x7e0]: 44100 48000 88200 96000 176400 192000
    bits [0xe]: 16 20 24
    formats [0x1]: PCM
Default Amp-In caps: ofs=0x00, nsteps=0x0f, stepsize=0x05, mute=1
Default Amp-Out caps: ofs=0x7f, nsteps=0x7f, stepsize=0x02, mute=1
Node 0x02 [Audio Output] wcaps 0xd0c05: Stereo Amp-Out
  Amp-Out caps: N/A
  Amp-Out vals:  [0xff 0xff]
  Power: 0x0
Node 0x03 [Audio Output] wcaps 0xd0c05: Stereo Amp-Out
  Amp-Out caps: N/A
  Amp-Out vals:  [0xff 0xff]
  Power: 0x0
Node 0x04 [Audio Output] wcaps 0xd0c05: Stereo Amp-Out
  Amp-Out caps: N/A
  Amp-Out vals:  [0x7f 0x7f]
  Power: 0x0
Node 0x05 [Audio Output] wcaps 0xd0c05: Stereo Amp-Out
  Amp-Out caps: N/A
  Amp-Out vals:  [0xff 0xff]
  Power: 0x0
Node 0x06 [Audio Input] wcaps 0x1d0541: Stereo
  Power: 0x0
  Connection: 1
     0x07
Node 0x07 [Audio Selector] wcaps 0x300903: Stereo Amp-In
  Amp-In caps: N/A
  Amp-In vals:  [0x0f 0x0f]
  Connection: 1
     0x0e
Node 0x08 [Audio Input] wcaps 0x1d0541: Stereo
  Power: 0x0
  Connection: 1
     0x09
Node 0x09 [Audio Selector] wcaps 0x300903: Stereo Amp-In
  Amp-In caps: N/A
  Amp-In vals:  [0x80 0x80]
  Connection: 1
     0x15
Node 0x0a [Pin Complex] wcaps 0x400181: Stereo
  Pincap 0x08173c: IN OUT HP Detect
  Pin Default 0x02214113: [Jack] HP Out at Ext Front
    Conn = 1/8, Color = Green
  Pin-ctls: 0x00:
  Connection: 1
     0x02
Node 0x0b [Pin Complex] wcaps 0x400181: Stereo
  Pincap 0x0814: OUT Detect
  Pin Default 0x01016112: [Jack] Line Out at Ext Rear
    Conn = 1/8, Color = Orange
  Pin-ctls: 0x40: OUT
  Connection: 1
     0x04
Node 0x0c [Pin Complex] wcaps 0x400181: Stereo
  Pincap 0x0814: OUT Detect
  Pin Default 0x01011111: [Jack] Line Out at Ext Rear
    Conn = 1/8, Color = Black
  Pin-ctls: 0x00:
  Connection: 1
     0x03
Node 0x0d [Pin Complex] wcaps 0x400181: Stereo
  Pincap 0x08173c: IN OUT HP Detect
  Pin Default 0x02a19920: [Jack] Mic at Ext Front
    Conn = 1/8, Color = Pink
  Pin-ctls: 0x00:
  Connection: 1
     0x02
Node 0x0e [Pin Complex] wcaps 0x400081: Stereo
  Pincap 0x0824: IN Detect
  Pin Default 0x01813121: [Jack] Line In at Ext Rear
    Conn = 1/8, Color = Blue
  Pin-ctls: 0x20: IN
Node 0x0f [Pin Complex] wcaps 0x400181: Stereo
  Pincap 0x0814: OUT Detect
  Pin Default 0x01014110: [Jack] Line Out at Ext Rear
    Conn = 1/8, Color = Green
  Pin-ctls: 0x00:
  Connection: 1
     0x05
Node 0x10 [Audio Output] wcaps 0x40211: Stereo Digital
  PCM:
    rates [0x3e0]: 44100 48000 88200 96000 176400
    bits [0xe]: 16 20 24
    formats [0x5]: PCM AC3
Node 0x11 [Pin Complex] wcaps 0x400301: Stereo Digital
  Pincap 0x0810: OUT
  Pin Default 0x01451114: [Jack] SPDIF Out at Ext Rear
    Conn = Optical, Color = Black
  Pin-ctls: 0x00:
  Connection: 2
     0x10* 0x09
Node 0x12 [Audio Input] wcaps 0x140311: Stereo Digital
  PCM:
    rates [0x160]: 44100 48000 96000
    bits [0xe]: 16 20 24
    formats [0x5]: PCM AC3
  Connection: 1
     0x13
Node 0x13 [Pin Complex] wcaps 0x440381: Stereo Digital
  Pincap 0x0834: IN OUT Detect
  Pin Default 0x411111f0: [N/A] Speaker at Ext Rear
    Conn = 1/8, Color = Black
  Pin-ctls: 0x00:
  Connection: 1
     0x18
Node 0x14 [Pin Complex] wcaps 0x400001: Stereo
  Pincap 0x0820: IN
  Pin Default 0x99931122: [Fixed] Aux at Int ATAPI
    Conn = ATAPI, Color = Black
  Pin-ctls: 0x00:
Node 0x15 [Audio Selector] wcaps 0x30010d: Stereo Amp-Out
  Amp-Out caps: ofs=0x00, nsteps=0x04, stepsize=0x27, mute=1
  Amp-Out vals:  [0x00 0x00]
  Connection: 4
     0x0a* 0x0d 0x14 0x02
Node 0x16 [Beep Generator Widget] wcaps 0x70000c: Mono Amp-Out
  Amp-Out caps: ofs=0x03, nsteps=0x03, stepsize=0x17, mute=0
  Amp-Out vals:  [0x00]
Node 0x17 [Volume Knob Widget] wcaps 0x600000: Mono
Node 0x18 [Audio Output] wcaps 0x40201: Stereo Digital
